{
  "chat_id": "123",
  "text": "abc",
  "parse_mode": "HTML",
  "disable_web_page_preview": true,
  "disable_notification": true,
  "reply_to_message_id": 123,
  "allow_sending_without_reply": true,
  "reply_markup": "",
  "entities": [
    {
      "type": "mention",
      "offset": 0,
      "length": 123,
      "url": 0,
      "user": {
        "id": 123,
        "is_bot": false,
        "first_name": "abc",
        "last_name": "",
        "username": "",
        "language_code": "",
        "can_join_groups": true,
        "can_read_all_group_messages": true,
        "supports_inline_queries": true
      },
      "language": ""
    }
  ]
}